{
  "code": "C09",
  "revision": 2,
  "name": {
    "zh": "蜡笔水墨和风绘本",
    "en": "Crayon-and-Ink Japanese Storybook"
  },
  "family": "温暖手绘·绘本动画",
  "fit": [
    "讲故事"
  ],
  "facets": {
    "medium": "蜡笔水墨和风绘本",
    "density": "中等"
  },
  "visibility": "public",
  "source": {
    "from": "handraw-style #252（描述已重写，不含人名）",
    "license": "MIT",
    "notes": "基于 2026-09-25 同题三题提示词的共同风格段整理；基础可调用版，尚未通过准入。"
  },
  "essence": [
    "蜡笔炭笔颗粒",
    "柔和墨色晕染",
    "低饱和土色与少量翠绿"
  ],
  "recipe": {
    "positive": "Visual style (follow exactly): Soft crayon and sumi-e storybook: warm grainy charcoal and crayon texture combined with soft ink-wash shading, rustic hand-drawn feel, gentle muted earthy colours with occasional emerald-green accents, oversized gentle animals next to small figures, cosy Japanese picture-book atmosphere.",
    "text_mode": [
      "native",
      "overlay",
      "none"
    ]
  },
  "palette": {
    "recolor": "free"
  },
  "qa": {
    "must_see": [
      "蜡笔炭笔颗粒",
      "柔和墨色晕染",
      "低饱和土色与少量翠绿"
    ],
    "must_not_see": [
      "光滑矢量或强烈荧光色",
      "未请求的文字或水印"
    ]
  },
  "evidence": {
    "admission": "pending",
    "model": "未在基础合同上完成模型实测",
    "date": "2026-09-29",
    "notes": "仅完成合同校验与提示词编译；同题提示词与参考图存在，但此修订尚未完成正式八题、稳定性和版式盲评。"
  },
  "changelog": [
    {
      "revision": 1,
      "date": "2026-09-29",
      "note": "从同题提示词整理基础可调用合同；准入待验证"
    },
    {
      "revision": 2,
      "date": "2026-09-29",
      "note": "加入同题原图的画风锚点；只引用画法并隔离参考图内容，正式准入仍待验证"
    }
  ],
  "anchor": {
    "file": "anchor.png",
    "sha256": "27711d7cb97c97af7225592d51a762e519849aafffbb1c054afc3a98a7560344",
    "isolation": "This image is only a visual-style sample. Transfer its rendering technique, line or brush character, material, texture, and color tendency. All people, objects, pose, setting, composition, layout, and words must come exclusively from the current content brief; never reuse the reference image's story or subjects."
  }
}
