{
  "code": "C27",
  "revision": 3,
  "name": {
    "zh": "纸雕层叠",
    "en": "Layered Paper Sculpture"
  },
  "family": "立体材质",
  "fit": [
    "封面",
    "讲故事"
  ],
  "facets": {
    "medium": "纸雕层叠",
    "density": "中等"
  },
  "visibility": "public",
  "source": {
    "from": "hand-drawn-styles #13",
    "license": "MIT",
    "notes": "基于 2026-09-25 同题三题提示词的共同风格段整理；基础可调用版，尚未通过准入。"
  },
  "essence": [
    "多层纸雕形成真实厚度",
    "纸边与投影清晰可辨",
    "暖光下的微缩立体舞台"
  ],
  "recipe": {
    "positive": "Visual style (follow exactly): A sculptural 3D paper-craft diorama artwork, rendered like a soft 3D render of a handcrafted layered paper sculpture, NOT flat papercut, NOT symmetrical ornament. CHARACTER RECIPE (for any figure): THE HEAD IS SCULPTURAL — a smooth rounded three-dimensional sculpted form like a stop-motion puppet, softly shaded with real volume, NOT a flat paper cutout face; the bangs are a smooth volumetric dome of thick curved paper sweeping across the forehead and casting a soft shadow on it; the nose is a small 3D paper wedge physically protruding from the face, catching light on one side and casting a tiny shadow on the other; gently rounded cheeks with soft rosy blush circles; closed eyes as thin calm curved lines; tiny serene lips; hair and clothing built from thick curved paper ribbons, rolled quilling spirals, pleated paper fans and layered scalloped paper feathers like overlapping bird plumage; some pieces carry embossed damask folk patterns. FOLK ELEMENTS: a few Scandinavian folk-art paper pieces placed beside the subject —one stylized folk cloud, a few stylized leaves and one rolled paper spiral— sparse, asymmetric editorial composition with lots of breathing room. MATERIAL: every piece is matte felt-like cardstock with visible embossed fiber texture and fine swirling filigree embossing, slightly curled edges. DEPTH & LIGHT (most important): strong sculptural depth — elements physically raised several millimeters off the background, casting large soft realistic drop shadows onto the wall and onto each other; soft warm studio lighting from upper left; the plain background has a soft directional light gradient — noticeably brighter toward the upper left, gently darker in the lower corners (gentle vignette). PALETTE: muted jewel tones — mustard yellow, ochre, coral orange, magenta pink, lilac purple, slate blue, teal — on a warm earthy backdrop. Warm handcrafted editorial illustration mood.",
    "text_mode": [
      "native",
      "overlay",
      "none"
    ]
  },
  "palette": {
    "recolor": "free"
  },
  "qa": {
    "must_see": [
      "多层纸雕形成真实厚度",
      "纸边与投影清晰可辨",
      "暖光下的微缩立体舞台"
    ],
    "must_not_see": [
      "平面剪纸或对称纹饰",
      "未请求的文字或水印"
    ]
  },
  "evidence": {
    "admission": "pending",
    "model": "未在基础合同上完成模型实测",
    "date": "2026-09-30",
    "notes": "配方加入原作名并换用原作样图（或取消自产锚点）；仅完成合同校验与同题试出图，尚未通过正式准入。"
  },
  "changelog": [
    {
      "revision": 1,
      "date": "2026-09-29",
      "note": "从同题提示词整理基础可调用合同；准入待验证"
    },
    {
      "revision": 2,
      "date": "2026-09-29",
      "note": "加入同题原图的画风锚点；只引用画法并隔离参考图内容，正式准入仍待验证"
    },
    {
      "revision": 3,
      "date": "2026-09-30",
      "note": "画风库 v2：配方加入原作名；旧自产锚点退役（移入 legacy/），改用 MIT 原作样图或不配锚点；新增用途、渲染器与同题样图。"
    }
  ],
  "anchor": {
    "file": "anchor.png",
    "sha256": "0dacbe7d67a97c414da09fa599dd6d16826c983d551469bb5ece85a010a5c946",
    "enabled": true,
    "isolation": "This image is only a visual-style sample. Transfer its rendering technique, line or brush character, material, texture, and colour tendency. All people, objects, pose, setting, composition, layout, and words must come exclusively from the current content brief; never reuse the reference image's story or subjects; hair colour, hairstyle, faces and clothing come only from the brief.",
    "origin": {
      "repo": "threerocks/hand-drawn-styles",
      "item": "13-paper-folk.png",
      "license": "MIT",
      "url": "https://raw.githubusercontent.com/threerocks/hand-drawn-styles/master/examples/13-paper-folk.png"
    }
  },
  "inspiration": {
    "names": [],
    "prompt": ""
  },
  "uses": [
    "封面",
    "文章插图",
    "小红书",
    "漫画",
    "绘本",
    "音乐封面"
  ],
  "renderer": "codex",
  "samples": [
    {
      "topic": "人物",
      "file": "samples/s1.jpg",
      "source_sha256": "a39b417b9777b832409e322b10666f2982c22480873eb35c631647ee63699cad",
      "renderer": "codex-builtin",
      "date": "2026-09-30",
      "ratio": 1.0
    },
    {
      "topic": "物件",
      "file": "samples/s2.jpg",
      "source_sha256": "91fe320c73faba4102b21637734ae3107ce945552f9eeced38b1c1814d37d928",
      "renderer": "codex-builtin",
      "date": "2026-09-30",
      "ratio": 1.0
    },
    {
      "topic": "信息图",
      "file": "samples/s3.jpg",
      "source_sha256": "5970401fc5f008b0b8933dfd6544cb3681ca0cb8ef0dbeec24eeb0912d3bfe99",
      "renderer": "codex-builtin",
      "date": "2026-09-30",
      "ratio": 1.0
    },
    {
      "topic": "风格参考板",
      "file": "samples/bd.webp",
      "renderer": "codex-builtin",
      "date": "2026-10-02",
      "ratio": 1.776
    },
    {
      "topic": "公众号封面",
      "file": "samples/cv.webp",
      "renderer": "codex-builtin",
      "date": "2026-10-02",
      "ratio": 2.35
    },
    {
      "topic": "音乐封面",
      "file": "samples/au.webp",
      "renderer": "codex-builtin",
      "date": "2026-10-02",
      "ratio": 1.0
    },
    {
      "topic": "横版插图 第 1 张",
      "file": "samples/wxi.webp",
      "renderer": "codex-builtin",
      "date": "2026-10-02",
      "ratio": 1.776
    },
    {
      "topic": "横版插图 第 2 张",
      "file": "samples/wxi-2.webp",
      "renderer": "codex-builtin",
      "date": "2026-10-02",
      "ratio": 1.776
    },
    {
      "topic": "横版插图 第 3 张",
      "file": "samples/wxi-3.webp",
      "renderer": "codex-builtin",
      "date": "2026-10-02",
      "ratio": 1.776
    },
    {
      "topic": "竖版插图 第 1 张",
      "file": "samples/wxt.webp",
      "renderer": "codex-builtin",
      "date": "2026-10-02",
      "ratio": 0.562
    },
    {
      "topic": "竖版插图 第 2 张",
      "file": "samples/wxt-2.webp",
      "renderer": "codex-builtin",
      "date": "2026-10-02",
      "ratio": 0.562
    },
    {
      "topic": "推特单图",
      "file": "samples/wxx.webp",
      "renderer": "codex-builtin",
      "date": "2026-10-02",
      "ratio": 1.776
    },
    {
      "topic": "小红书 第 1 张",
      "file": "samples/xhs.webp",
      "renderer": "codex-builtin",
      "date": "2026-10-02",
      "ratio": 0.75
    },
    {
      "topic": "小红书 第 2 张",
      "file": "samples/xhs-2.webp",
      "renderer": "codex-builtin",
      "date": "2026-10-02",
      "ratio": 0.75
    },
    {
      "topic": "小红书 第 3 张",
      "file": "samples/xhs-3.webp",
      "renderer": "codex-builtin",
      "date": "2026-10-02",
      "ratio": 0.75
    },
    {
      "topic": "小红书 第 4 张",
      "file": "samples/xhs-4.webp",
      "renderer": "codex-builtin",
      "date": "2026-10-02",
      "ratio": 0.75
    },
    {
      "topic": "小红书 第 5 张",
      "file": "samples/xhs-5.webp",
      "renderer": "codex-builtin",
      "date": "2026-10-02",
      "ratio": 0.75
    },
    {
      "topic": "小红书 第 6 张",
      "file": "samples/xhs-6.webp",
      "renderer": "codex-builtin",
      "date": "2026-10-02",
      "ratio": 0.75
    },
    {
      "topic": "四格漫画",
      "file": "samples/cm.webp",
      "renderer": "codex-builtin",
      "date": "2026-10-02",
      "ratio": 1.0
    }
  ]
}
