{
  "code": "C75",
  "revision": 1,
  "name": {
    "zh": "暖纸克制双色",
    "en": "Warm Paper Two-Colour Editorial"
  },
  "family": "封面与海报",
  "fit": [
    "讲道理",
    "封面"
  ],
  "facets": {
    "medium": "暖纸克制双色",
    "density": "极简留白"
  },
  "visibility": "public",
  "source": {
    "from": "original",
    "license": "original",
    "notes": "2026-10-01 按封面调研新增：学习成熟的封面做法（类型与渲染拆分、单一强焦点、标题与画面呼应），自行撰写配方；基础可调用版，尚未通过准入。"
  },
  "essence": [
    "暖奶油纸底与细纸纹",
    "深墨色加一个暖金或红的点缀色",
    "一个简洁有力的主体与大量留白"
  ],
  "recipe": {
    "positive": "Visual style (follow exactly): Editorial cover illustration in the manner of a literary magazine: warm cream paper background with subtle paper grain, a restrained two-colour palette (one deep ink colour plus one warm gold or red accent), one iconic object drawn with clean confident shapes, generous negative space, thin keylines, calm bookish and premium; no gradients, no glow, no clutter.",
    "text_mode": [
      "native",
      "none"
    ]
  },
  "palette": {
    "recolor": "free"
  },
  "qa": {
    "must_see": [
      "暖奶油纸底与细纸纹",
      "深墨色加一个暖金或红的点缀色",
      "一个简洁有力的主体与大量留白"
    ],
    "must_not_see": [
      "多色堆砌或渐变发光",
      "背景塞满小图标",
      "未请求的文字或水印"
    ]
  },
  "evidence": {
    "admission": "pending",
    "model": "尚未实测",
    "date": "2026-10-01",
    "notes": "新增封面类风格，仅完成合同校验；样图见试点。"
  },
  "changelog": [
    {
      "revision": 1,
      "date": "2026-10-01",
      "note": "新增：封面调研后的封面类风格，准入待验证"
    }
  ],
  "inspiration": {
    "names": [
      "《纽约客》封面插画"
    ],
    "prompt": "《纽约客》封面插画"
  },
  "uses": [
    "封面",
    "文章插图",
    "音乐封面"
  ],
  "renderer": "codex",
  "samples": [
    {
      "topic": "封面（标题写在图上）",
      "file": "samples/cv.webp",
      "renderer": "codex-builtin",
      "date": "2026-10-01"
    },
    {
      "topic": "文章插图（概括图）",
      "file": "samples/wxi.webp",
      "renderer": "codex-builtin",
      "date": "2026-10-01"
    },
    {
      "topic": "文章插图（概括图） 第 2 张",
      "file": "samples/wxi-2.webp",
      "renderer": "codex-builtin",
      "date": "2026-10-01"
    },
    {
      "topic": "文章插图（概括图） 第 3 张",
      "file": "samples/wxi-3.webp",
      "renderer": "codex-builtin",
      "date": "2026-10-01"
    }
  ]
}
