{
  "code": "C35",
  "revision": 4,
  "name": {
    "zh": "Notion 知识线稿",
    "en": "Minimal Knowledge Doodle"
  },
  "family": "讲道理·知识图解",
  "fit": [
    "讲道理"
  ],
  "facets": {
    "medium": "Notion 知识线稿",
    "density": "中等"
  },
  "visibility": "public",
  "source": {
    "from": "baoyu-skills notion",
    "license": "MIT",
    "notes": "基于 2026-09-25 同题三题提示词的共同风格段整理；基础可调用版，尚未通过准入。"
  },
  "essence": [
    "轻微手抖的简洁线稿",
    "单一概念和大留白",
    "少量柔和强调色"
  ],
  "recipe": {
    "positive": "Visual style (follow exactly): in the style of Notion-style hand-drawn line illustration. Minimal hand-drawn knowledge doodle on clean white or off-white paper. Focus on one concept using simple single-weight black lines with slight hand wobble, small conceptual icons, maximum whitespace and only sparse pastel accents. Keep the composition thoughtful and orderly.",
    "text_mode": [
      "native",
      "overlay",
      "none"
    ]
  },
  "palette": {
    "recolor": "free"
  },
  "qa": {
    "must_see": [
      "轻微手抖的简洁线稿",
      "单一概念和大留白",
      "少量柔和强调色"
    ],
    "must_not_see": [
      "复杂纹理或多色拥挤排版",
      "未请求的文字或水印"
    ]
  },
  "evidence": {
    "admission": "pending",
    "model": "未在基础合同上完成模型实测",
    "date": "2026-09-30",
    "notes": "配方加入原作名并换用原作样图（或取消自产锚点）；仅完成合同校验与同题试出图，尚未通过正式准入。"
  },
  "changelog": [
    {
      "revision": 1,
      "date": "2026-09-29",
      "note": "从同题提示词整理基础可调用合同；准入待验证"
    },
    {
      "revision": 2,
      "date": "2026-09-29",
      "note": "加入同题原图的画风锚点；只引用画法并隔离参考图内容，正式准入仍待验证"
    },
    {
      "revision": 3,
      "date": "2026-09-30",
      "note": "画风库 v2：配方加入原作名；旧自产锚点退役（移入 legacy/），改用 MIT 原作样图或不配锚点；新增用途、渲染器与同题样图。"
    },
    {
      "revision": 4,
      "date": "2026-10-02",
      "note": "加入叁笙自制的无人物风格参考板作为画风锚点（色板、材质、母题、构图），出图时自动当画风参考；不含人物与动物，避免内容串入。"
    }
  ],
  "inspiration": {
    "names": [
      "Notion 插图风"
    ],
    "prompt": "Notion-style hand-drawn line illustration"
  },
  "uses": [
    "小红书",
    "信息图",
    "PPT",
    "漫画",
    "绘本"
  ],
  "renderer": "codex",
  "samples": [
    {
      "topic": "人物",
      "file": "samples/s1.jpg",
      "source_sha256": "ecf50b9d3ef80cd7911ca996681622dc4bbc4991184bd344b27b59c3bafdabab",
      "renderer": "codex-builtin",
      "date": "2026-09-30"
    },
    {
      "topic": "物件",
      "file": "samples/s2.jpg",
      "source_sha256": "e261eb98417a34c5bb81f841a77fd5d24b233c061323f2b9ee14289ceee47c80",
      "renderer": "codex-builtin",
      "date": "2026-09-30"
    },
    {
      "topic": "信息图",
      "file": "samples/s3.jpg",
      "source_sha256": "9658bbc391b672ae7e35911cf239b65df36e2a619ae036d6dc1dddaecefbc8a5",
      "renderer": "codex-builtin",
      "date": "2026-09-30"
    },
    {
      "topic": "小红书知识卡",
      "file": "samples/xhs.webp",
      "renderer": "codex-builtin",
      "date": "2026-10-01"
    },
    {
      "topic": "小红书知识卡 第 2 张",
      "file": "samples/xhs-2.webp",
      "renderer": "codex-builtin",
      "date": "2026-10-01"
    },
    {
      "topic": "小红书知识卡 第 3 张",
      "file": "samples/xhs-3.webp",
      "renderer": "codex-builtin",
      "date": "2026-10-01"
    },
    {
      "topic": "小红书知识卡 第 4 张",
      "file": "samples/xhs-4.webp",
      "renderer": "codex-builtin",
      "date": "2026-10-01"
    },
    {
      "topic": "信息图",
      "file": "samples/inf.webp",
      "renderer": "codex-builtin",
      "date": "2026-10-01"
    },
    {
      "topic": "信息图 第 2 张",
      "file": "samples/inf-2.webp",
      "renderer": "codex-builtin",
      "date": "2026-10-01"
    },
    {
      "topic": "PPT 一页",
      "file": "samples/ppt.webp",
      "renderer": "codex-builtin",
      "date": "2026-10-01"
    },
    {
      "topic": "PPT 一页 第 2 张",
      "file": "samples/ppt-2.webp",
      "renderer": "codex-builtin",
      "date": "2026-10-01"
    },
    {
      "topic": "PPT 一页 第 3 张",
      "file": "samples/ppt-3.webp",
      "renderer": "codex-builtin",
      "date": "2026-10-01"
    },
    {
      "topic": "四格漫画",
      "file": "samples/cm.webp",
      "renderer": "codex-builtin",
      "date": "2026-10-01"
    },
    {
      "topic": "日漫标准页",
      "file": "samples/cp.webp",
      "renderer": "codex-builtin",
      "date": "2026-10-01"
    }
  ],
  "anchor": {
    "file": "anchor.png",
    "sha256": "75e944970fa122eabeab575f9ab6971f7022f20a28a74bf509f11cbd0caf4c84",
    "enabled": true,
    "isolation": "This image is a style reference sheet for this visual style. Transfer only its rendering technique, line or brush character, material, texture, colour tendency and decorative language. Never copy the sheet's layout, panels, swatches, labels, words, objects or composition; all subjects, layout and text come exclusively from the current brief."
  }
}
